Dow regains some of this week's losses,"After a harrowing week for financial markets, investors will look for solid corporate earnings reports and healthy economic news over the next few weeks to calm things down.

This week, sharply higher bond yields, fears of faster rate hikes, and the prospect of a long trade war between the United States and China prompted a two-day rout in the stock market. The Dow Jones Industrial Average plummeted 1,300 points on Wednesday and Thursday.

Even as the Dow regained almost 300 of those points Friday, some experts said investors’ concerns haven’t been resolved. But if fresh evidence emerges that the economy remains healthy and growing, and companies are still churning out robust profit gains, the stock market may eventually push aside those fears.

“The basic question everybody has to ask is, has the fundamental situation deteriorated or not?” said David Kelly, chief global strategist for JPMorgan Funds. “Unless something else goes wrong, volatility will ultimately settle down and stocks will move up.”

The third-quarter earnings season will intensify in the coming weeks and should show whether profit growth remains strong despite the market’s worries. Earnings are projected to grow nearly 20 percent from a year earlier, a healthy gain if slightly below the previous two quarters.

That could be a tough hurdle to clear: 74 companies in the Standard & Poor’s 500 index have already said their earnings will come in below analysts’ estimates. That’s more companies than normally issue such warnings.

“Keep in mind that the analysts have set the bar really high for the (third quarter) earnings season,” David Rosenberg, chief economist at Gluskin Sheff, wrote in a note to clients.

Just as importantly as the numbers, investors will focus on what company executives say about the impact of the U.S.-China trade fight, higher interest rates, and other challenges facing the economy. Talk of threats to future profit growth could jar investors and offset any positive vibe from good numbers for the quarter just past.

The trade issue “is going to be a huge focus,” said David Joy, chief market strategist at Ameriprise.

That’s because it’s still not clear what the long-run impact of the tariffs will be. Will American multinationals, such as Caterpillar, Apple and GM, start to shift some of their production out of China? Will they start to raise prices on more products to offset the cost of the duties?

“Breaking down global supply chains is inflationary,” Rosenberg said.

Those concerns are rising because economists increasingly expect the Trump administration’s fight with China to continue for the foreseeable future. Many investors and business executives have previously assumed that the administration’s tariffs were intended to win short-term concessions.

But unlike Trump’s other fights with countries like Canada, which focus on specific tariffs and specific products, the administration’s complaints with China are centered on more sweeping issues such as intellectual property rights and that country’s industrial policy.

“We expect this to be quite protracted,” Joy said. “These are really big, strategic geopolitical issues that aren’t easily solved.”

President Trump and China’s President Xi Jingping are now scheduled to meet at an international financial summit in late November. If the two leaders can agree at that meeting to hold off on further import taxes while they iron out their differences, that could give the markets a boost, Joy said.

Some economic reports next week may also assuage investors’ concerns — or fuel them. A report on retail and restaurant sales will show if consumers are still spending at a healthy clip. Expectations are high: Analysts forecast that sales grew 0.6 percent in September, after barely expanding the previous month.

And on Friday, the National Association of Realtors will report on sales of existing homes last month. Sales have fallen 1.5 percent in the past year, as sharp price increases have outpaced wage gains, leaving many potential home-buyers unable to afford a purchase.

And now mortgage rates have jumped to their highest level in seven years, making houses less affordable. The average rate on a 30-year fixed mortgage rose to 4.9 percent this week, from 3.9 percent a year ago.

The retail and home sales data could be disrupted by the impact of Hurricane Florence, which tore through the Carolinas in September. Hurricane Michael won’t show up in the data until next month.

Still, economists forecast that home sales in September will decline again.

Slowing housing sales have already worried some economists, who see it as a sign that the economic expansion may not last that much longer.

“I think of housing as the canary in the coal mine,” said Diane Swonk, chief economist at Grant Thornton."
Dow wipes out a more than 400-point opening gain to briefly turn negative in powerful reversal,"The Dow Jones Industrial Average lost steam in midday action Friday, with the blue-chip index shedding much of its intraday gain to turn momentarily negative. The Dow DJIA, +0.79% most recently, was up 70 points, or 0.3% at 25,126. The index had been up by as many as 414 points, or 1.7%, at the start of trading, signaling that a powerful rebound from a two-session rout may be at hand. Meanwhile, the S&P 500 index SPX, +0.82% was trading with a gain of 0.5% at 2,741, while the Nasdaq Composite Index COMP, +0.79% was up 1.1%. All three benchmarks were well off their best levels of the session. Friday's action comes after the Dow shed roughly 1,400 points between Wednesday and Thursday. That sharp drop prompted by growing fears about rapidly rising interest rates has left the equity gauges in position to post their worst weekly losses since March. For the Dow, shares of Boeing Co. [s; BA], were creating a roughly 20-point headwind for the benchmark on Friday.

Have breaking news sent to your inbox. Subscribe to MarketWatch's free Bulletin emails. Sign up here."
Dow Gains 170 Points as Stocks Rage Against the Dying of the Light,"Text size

6:35 a.m. Stocks are trying to come back from their worst start to a quarter in years. Which is exactly what we’d be expected.

S&P 500 futures have 0.8%, while Dow Jones Industrial Average futures have 170 points, or 0.7%. Nasdaq Composite futures have climbed 1.4%.

Why the drop. “While there was a litany of excuses—including higher rates, a more hawkish Fed, midterm elections, and trade—none of them explained the selloff,” writes Credit Suisse analyst Jonathan Golub. “Historically, investing on volatility spikes leads to above average returns in subsequent months. We reiterate our bullish market call and TECH+ overweight, and believe that investors should opportunistically extend risk against this higher volatility.”

Time will tell if he’s right."
"Trouble lurks in the stock market, with one-third of S&P 500 trading in bear territory","CLOSE The Dow plunged more than 800 points Wednesday, its worst drop in eight months. Rising bond yields have been drawing investors out of the stock market. The best-performing stocks over the past year took some of the biggest losses. (Oct. 10) AP

epa07086828 A board shows the Dow Jone industrial average on the floor of the New York Stock Exchange in New York, New York, USA, on 11 October 2018. The Dow Jones industrial average lost nearly 550 points today. EPA-EFE/JUSTIN LANE ORG XMIT: JLX21 (Photo: JUSTIN LANE, EPA-EFE)

Damage assessments from the recent market slump are rolling in, and stock losses are more gruesome and bigger than they appear on the surface.

The downfall of many individual stocks has been far more sizable than the broad stock market's discomforting but manageable 7 percent drop from its late September high, data show.

Big time troubles for the struggling bull market lurk in the deeper pool of companies that make up the Standard & Poor's 500 stock index. Shares of many of them are in full retreat, with 165 companies, or one-third of the index, now in bear market territory.

That means their stock prices are down more than 20 percent from their recent highs, according to Bloomberg data through Friday morning.

In dollar terms, investors suffered a paper loss of $2.5 trillion on U.S. stocks from the market's record high on September 20 through Thursday, according to Wilshire Associates.

""It has been a really rough start to the fourth quarter,"" says Thomas Lee, managing partner at Fundstrat Global Advisors, a New York-based investment firm.

A confluence of factors is spooking investors: fears of rising interest rates; trade tensions with China; and a feeling that the strong earnings and healthy economy can only get worse, not better.

""We just dropped 1,400 Dow points in two days, (but) the average stock is much, much worse,"" says Gary Kaltbaum, president of Kaltbaum Capital Management. ""It tells you how much real weakness there has been.""

Among S&P 500 companies, shares of Newell Brands, the maker of Sharpie markers, Coleman coolers and Rawlings baseball gloves, have fallen the most from their most recent high: 59 percent.

More: What is the stock market doing today? Dow opens sharply higher

More: Stock market sell-off could signal turning point for bull market, as Dow plunges again

More: Why did the stock market drop? Here are all the reasons for the Dow plunge

Many of the other big losers are stocks that are sensitive to rising interest rates or fallout from tariffs. Still others are former high-flyers that were prime candidates for investors to cash out of when the market plunged.

Here's a glance at the fallen:

FILE - In this Jan. 6, 2012, file photo, Lennar homes are advertised for sale in San Jose, Calif. Lennar Corp. reports financial results on Tuesday, Sept. 20, 2016. (AP Photo/Paul Sakuma, File) ORG XMIT: NYBZ207 (Photo: Paul Sakuma, AP)

Stocks hurt by spiking borrowing costs

One slice of the market weighed down by higher interest rates is home-building companies. The shares of Lennar and Pulte Group are down 40 percent and 34 percent, respectively, from their recent highs. Their home-buying clients will pay more now that mortgages carry higher interest rates. The rate on the 30-year fixed-rate home loan -- the most popular mortgage for purchases -- recently ticked above 5 percent for the first time since early 2011. That makes it more challenging for people already facing higher prices and low inventory to afford a home.

Analysts fear that automakers like Ford Motor, whose stock is down nearly 35 percent from its recent high, and General Motors, which is down more than 30 percent, will also suffer from weaker sales due to higher financing costs for new and used cars.

Both companies' businesses have also been dinged by the rising cost of commodities, largely due to President Trump's 25 percent tariff on imported steel. Back in July, GM reported $300 million in increased commodity costs in the second quarter. Similarly, Ford said tariffs resulted in $145 million in higher costs and could rise to as much as $600 million for the full year.

Shares upended by tariffs

It's not just automakers being hurt by tariffs. Home appliance maker Whirlpool, whose shares are down 44 percent from their recent high, downgraded its full-year profit outlook in July. The gloomier forecast was based in part on an increase of $200 million in raw material costs because of the 25 percent import tariffs on steel and 10 percent tariffs on aluminum.

Bill Davidson, the great grandson of William Davidson, one of four original founders of Harley-Davidson Motorcycles, sits atop his Harley in Scottsdale, Arizona, Wednesday, August 22, 2018. Davidson and other Harley enthusiasts stopped in Scottsdale during their San Diego to Milwaukee cross country ride to commemorate Harley’s 115th anniversary. There will be a big party in Milwaukee Aug. 29-Sept. 2. (Via OlyDrop) (Photo: Tom Tingle/The Republic)

Shares of Harley-Davidson are down more than 27 percent. Back in June, the iconic motorcycle maker said it would incur added costs of $45 million to $55 million this year due to trade disputes.

(FILES) File photo dated September 11, 2013 shows the logo of the social networking website 'Twitter' displayed on a computer screen in London. The San Francisco company Twitter announced on September 12, 2013, in a tweet, that it has submitted papers for a stock offering, the most hotly anticipated in the tech sector since Facebook's last year. ""We've confidentially submitted an S-1 to the SEC for a planned IPO. This Tweet does not constitute an offer of any securities for sale,"" the company tweeted. Talk of an initial public offering (IPO) has circulated about Twitter for some time, and the Wall Street Journal estimated the company founded in 2006 is worth some $10 billion. Twitter has become one of the fastest-growing and most influential social media services, used widely by celebrities, journalists, politicians and others. AFP PHOTO / LEON NEALLEON NEAL/AFP/Getty Images ORIG FILE ID: 522835057 (Photo: LEON NEAL, AFP/Getty Images)

Market darlings abandoned by followers

Popular tech stocks have also suffered steep declines. Investors are bailing out of these once-high-flying stocks in an effort to take profits and flee to parts of the market that they believe will hold up better in a downturn.

Shares of Twitter are down more than 43 percent from their recent high, Facebook is down nearly 30 percent, and video streaming service Netflix is 24 percent lower. The stock prices of Twitter and Facebook, whose top executives were recently grilled by federal lawmakers about user privacy issues and foreign manipulation of U.S. elections, have also come under pressure over fears of coming government regulation.

""It's not surprising to see a rotation out of high-flying names and into less-aggressive stocks,"" says Amanda Agati, co-chief investment strategist at PNC Financial Services Group.

CLOSE Bear Market is a term that sends fear into Wall Street and investors. What does it mean? And how does it affect both Wall Street and Main Street? Adam Shell explains.

Read or Share this story: https://www.usatoday.com/story/money/2018/10/12/stock-market-selloff-and-bear-market-stocks/1613062002/"
3 Reasons You Shouldn’t Worry About Wednesday’s 832-Point Drop in the Dow -- The Motley Fool,"As you might already know, the Dow Jones Industrial Average dropped by 832 points on Wednesday. This was the third-largest number of points the Dow has shed in a single trading session ever.

However, there's a lot more to that last sentence than meets the eye. In fact, despite the negative tones you might hear from market commentators on television, this move is no reason to panic. Here are three reasons I'm not at all worried about the recent market plunge and why you shouldn't be either.

This isn't even a major drop, historically speaking

Sure, the headline ""Dow Drops 832 Points"" looks scary, and commentators are quick to point out that it's the ""third-largest"" drop in history, but it's important to take a step back. Market plunges like this have indeed happened many times before.

The number 832 is high, but that's just because the Dow is close to a record high level right now. In terms of the percentage of the loss, Wednesday's 3.3% drop really isn't too bad. In fact, it isn't close to being one of the worst market plunges in history -- the plunge would have needed to be nearly 7% to even be in the top 20.

The point: Don't get too worked up over dramatic-sounding headlines after the market drops. Swings of 3% (or more) in single trading days aren't exactly rare. They've occurred many times throughout history and will certainly occur many times throughout the coming decades as well.

Moves like this are a normal part of a healthy stock market

Over the past 15 years, the worst time to invest would have been shortly before the financial crisis and Great Recession in 2008. If you invested $10,000 in an S&P 500 index fund at the start of 2008, before the financial crisis hit, how much do you think your investment would be worth now?

Here's some context. Since January 1, 2008, the S&P 500 has experienced 17 of its 20 largest one-day point declines in history, including four days when it dropped by 7% or more. And that's on top of a steady downward trend during 2008 and part of 2009 when the index lost 54% of its value altogether.

With this in mind, it might surprise you to learn that a $10,000 S&P index fund investment would have grown to more than $23,700 today. In other words, if you had invested in the stock market at the worst possible time in the past 15 years, you would have more than doubled your money.

The point is that moves like this are a normal part of a healthy stock market, and lots of money has been made over the years by long-term investors who largely ignore what the stock market is doing on a day-to-day basis.

Stocks just went on sale

To be clear, I don't suggest buying stocks just because their prices went down. Having said that, if you believe in a company for the long run and the drop had nothing to do with the company's business or future potential, a stock market drop is like a sale.

Consider Netflix (NASDAQ:NFLX) as an example. I've been considering adding Netflix to my portfolio for some time, but I thought the stock's price had become a little overheated recently. Well, in Wednesday's market plunge, Netflix lost 8.4% of its share price. Since Oct. 1, Netflix is down by roughly 15%.

Now, is Netflix inherently worth 15% less than it was just 11 days ago? Of course not. Think of it this way: If a new suit you'd been looking at that was a bit on the pricey end was marked down by 15%, it would look like a more compelling buy. The same logic applies to market drops like we saw this week.

In a nutshell, here's why you shouldn't worry:"
