"Dow Ends Up 282 Points Friday, Finishes Volatile Week Off 4%","What Are ""Closed-End"" Mutual Funds and How Do They Fit Into a Savvy Investors' Portfolios? Click here to register for a free online video in which TheStreet's retirement expert Robert Powell and an all-star panel run down all you need to know.

Stocks ended higher in a volatile session on Friday, Oct. 12 that saw major indexes open strong before giving up much of the day's gains in the middle of the day. Wall Street digested earnings from JPMorgan Chase & Co. (JPM) , Citigroup Inc. (C) and Wells Fargo & Co. (WFC) .

The Dow Jones Industrial Average rose 287 points, or 1.15%, to 25,340. For the week, the Dow was off more than 1,000 points, or 4.2%. The S&P 500 gained 1.42%, ending a six-day losing streak. The Nasdaq ended up 2.29%.

Declines on Thursday, Oct. 11, had pushed the Dow Jones Industrial Average's two-day losses to nearly 1,400 points and sent the Nasdaq into correction territory. The S&P 500 closed lower for a sixth straight day.

Investors have been rattled this week by higher bond yields, concerns over rising interest rates, trade tensions - particularly between the U.S. and China - and signs of slowing global economic growth. Yields on 10-year treasury notes were around 3.15% near the end of the day.

While a market rebound of some kind seemed likely Friday, volatility, as measured by the CBOE volatility index (VIX.X) , remains sharply higher than it has been in recent months. ""The VIX tells us to expect some big moves over the coming days until a trend develops,"" said Bob Lang, founder of ExplosiveOptions.net and a contributor to TheStreet.com's Trifecta Stocks Newsletter. The S&P 500 is still below its 200-day moving average, ""but if that is re-captured next week then there is a chance the uptrend can resume,"" Lang added. However, ""This week's heavy volume selling is not to be ignored.""

JPMorgan Chase, the largest U.S. bank, said third-quarter profit rose 24% from a year earlier thanks to the Trump administration's tax cuts even as revenue in its juggernaut trading business slowed. Net income was $2.34 a share vs. estimates of $2.26.

JPMorgan CEO Jamie Dimon noted the increasing uncertainty for the banking business with the impact of Trump's $1.5 trillion of tax cuts expected to fade next year, widening U.S. government budget deficits that have ballooned the national debt past $21 trillion, rising U.S. interest rates and the president's trade conflicts with China, Europe and Japan.

""The U.S. and the global economy continue to show strength, despite increasing economic and geopolitical uncertainties, which at some point in the future may have negative effects on the economy,"" Dimon said.

Total revenue climbed by 5% to $27.8 billion, while expenses climbed by 7%, the bank said. The stock fell 0.8%.

Citigroup earned $1.73 a share in the third quarter, topping Wall Street's expectations by 5 cents. Revenue of $18.39 billion came in just shy of estimates. The stock rose 2%.

Wells Fargo gained 1.3% on Friday. The bank's third-quarter adjusted profit was $1.16 a share, 3 cents below estimates.

JPMorgan and Citigroup are holdings in Jim Cramer's Action Alerts PLUS member club. Want to be alerted before Jim Cramer buys or sells the stocks? Learn more now.

General Electric Co. (GE) fell 3.1% after management pushed back when it would report third-quarter results and analysts questioned the beleaguered industrial conglomerate's financial standing, suggesting an equity raise and a dividend cut.

PNC Financial Services Group Inc. ( PNC ) reported third-quarter earnings of $2.82 a share, 10 cents ahead of forecasts. The stock declined 5.6%."
Tech Stock Rally Helps Snap Losing Streak as Rough Week Ends,"FILE - In this June 24, 2016, file photo, a man walks by the New York Stock Exchange. The U.S. stock market opens at 9:30 a.m. EDT on Friday, Oct. 12, 2018. (AP Photo/Richard Drew, File) The Associated Press

By MARLEY JAY, AP Markets Writer

NEW YORK (AP) — Stocks rebounded Friday, clawing back some of the week's steep losses, but the turbulent trading of the last few days left no doubt that the relative calm the markets enjoyed all summer had been shattered.

Major U.S. indexes ended the week down about 4 percent, their worst weekly loss in six months. An index measuring the performance of small-company stocks had its worst week since early 2016.

Big technology and consumer-focused companies led the recovery Friday. Longtime favorites of many investors, they had plunged in the last few days.

A major factor cited by market watchers for the pullback was a sharp increase in interest rates, which can slow the economy and make bonds more attractive to investors relative to stocks.

Apple climbed 3.6 percent to $222.11 and Microsoft gained 3.5 percent to $109.57. Amazon jumped 4 percent to $1,788.41. Those are the three most valuable companies in the U.S., and they suffered startling declines the last few days: on Wednesday each took its biggest loss in more than two years. That made for a dramatic end to three months of calm on the U.S. market.

The S&P 500 index rose 38.76 points, or 1.4 percent, to 2,767.13 to end a six-day losing streak. The benchmark index tumbled 4.1 percent this week, and it's down 5.6 percent since from its latest record high, set Sept. 20. Thanks in part to the big gain for technology companies, the Nasdaq composite jumped 167.83 points, or 2.3 percent, to 7,496.89.

The Dow Jones Industrial Average rose as much as 414 points early on, then gave it all up and turned slightly lower. It rebounded and finished with a gain of 287.16 points, or 1.1 percent, at 25,339.99.

The market's recent skid started last week, when strong economic data and positive comments from Federal Reserve Chair Jerome Powell helped set off a wave of selling in the bond market as investors they bet that the U.S. economy would keep growing at a healthy pace. That pushed bond prices lower and sent yields up to seven-year highs.

That drove interest rates sharply higher, which worried stock investors who felt that a big increase could stifle economic growth. The big swings in the market Friday suggest those fears haven't gone away. The VIX, a measurement of how much volatility investors expect, hasn't been this high in six months.

""What seems to have driven this is a fear interest rates were going to rise more quickly because the Fed was being too aggressive or the economy was going to overheat,"" said David Kelly, chief global strategist for JPMorgan Funds. Kelly said he doesn't think either of those fears is justified, as the Fed isn't raising interest rates that rapidly and economic growth hasn't sped up recently.

Small companies didn't fare as well. The Russell 2000 index rose just 1.30 points, or 0.1 percent, to 1,546.68 to wrap up its largest loss in one week since January 2016. High-dividend stocks like utilities and real estate investment trusts also rose less than the rest of the market. They held up relatively well over the past few days. Investors view them as relatively safe, steady assets that look better when growth is uncertain and the rest of the market is in turmoil.

U.S. automakers Ford and General Motors continued to slump. GM shed 1.6 percent to $31.79, its lowest in almost two years. Ford, trading at its lowest in almost nine years, dipped 1.9 percent to $8.64. Both have plunged this year as they deal with slowing sales and the Trump administration's tariffs on steel and aluminum, which are sending their manufacturing costs higher.

The stocks have fallen further in recent days following reports Ford might cut jobs. In late September, Ford CEO Jim Hackett said the steel and aluminum duties would cost the company $1 billion through 2019.

Investors are also growing more concerned that U.S.-China trade tensions are impairing global economic growth. The International Monetary Fund cut its forecast for global economic growth this week because of trade tensions and increased interest rates.

Sam Stovall, chief investment strategist for CFRA, said he thought stocks fell too far, but there could be more turmoil ahead for the markets. While stocks had done well in spite of the rising trade tensions between China and the U.S., investors seem more worried now.

""Everybody has been pretty much dismissing the effect of the trade war on U.S. equities, and now they're beginning to think 'wait a minute, maybe there could be a problem,'"" he said. ""I don't think the reasons for the decline have been resolved.""

Bond prices edged lower. The yield on the 10-year Treasury note rose to 3.15 percent 3.13 percent. At the beginning of the year it stood at 2.46 percent.

U.S. crude oil added 0.5 percent to $71.34 a barrel in in New York. Brent crude, the international standard, picked up 0.2 percent to $80.43 a barrel in London.

Wholesale gasoline rose 0.5 percent to $1.94 a gallon. Heating oil fell 0.5 percent to $2.32 a gallon. Natural gas lost 1.9 percent to $3.16 per 1,000 cubic feet.

Asian stocks also rebounded. Japan's Nikkei 225 index gained 0.5 percent after sinking early in the day and following a nearly 4 percent loss on Thursday. Hong Kong's Hang Seng surged 2.1 percent and the Kospi in South Korea rose 1.5 percent.

European stocks finished mostly lower. The French CAC 40 dipped 0.2 percent and so did the FTSE 100 in Britain. The DAX in Germany slipped 0.1 percent.

After a big jump Thursday, gold lost 0.5 percent to $1,222 an ounce. Silver rose 0.2 percent to $14.64 an ounce. Copper slipped 0.1 percent to $2.80 a pound.

The dollar slipped to 112.01 yen from 111.94 yen. The euro fell to $1.1563 from $1.1594.

____

AP Markets Writer Marley Jay can be reached at http://twitter.com/MarleyJayAP

Associated Press Writer Annabelle Liang contributed from Singapore."
"Dow ends higher Friday, but can't erase week's rout","Traders work on the floor of the New York Stock Exchange in New York on Oct. 11, 2018. (Photo: Justin Lane, EPA-EFE)

Market watchers can go into the weekend thinking it could have been a lot worse.

Stocks pulled off a strong showing Friday, but the rally wasn’t quite enough to recoup the steep losses from an earlier two-day rout.

The Dow Jones industrial average rose 287.16 points, or 1.15 percent, to close at 25,339.99. Still, the blue-chip index shed 1,107 points this week, its worst since March. On Wednesday, the index dropped more than 800 points, the biggest loss since February.

Other indexes, while making gains Friday, had similar bad weeks. The Standard & Poor's 500 index lost 4.1 percent, while the tech-heavy Nasdaq – hardest hit in Wednesday’s battering – ended the week down 3.74 percent.

The Russell 2000’s performance was the worst, however. The small-company stocks index fell into official correction territory Thursday and ended the week 11.16 percent off its Aug. 31 peak.

“Obviously, it was a tough week. The good news is things have stabilized today and, while we’re off from the day’s highs, the rebound was broad,” said Chris Cook, founder and president of Beacon Capital Management. “That’s a good sign heading into the weekend.”

Anxiety over a jump in interest rates coupled with the uncertain impact of Chinese tariffs on the economy ignited the sell-off Wednesday. Tech darlings got hammered hard two days ago but rebounded with noise Friday. Amazon gained 4.03 percent, Apple increased 3.57 percent and Netflix jumped 5.75 percent.

The biggest losers were trade-prone stocks such as Caterpillar, Boeing and 3M, which all lost almost 7 percent this week.

“We are moving away from a market driven by low interest rates to one that is based more on fundamentals, so companies dependent on borrowing for growth – like tech stocks – look less attractive,” said Timothy Chubb, CIO at Univest Wealth Management Division. “Investors are getting accustomed to that.”

Timing also exacerbated the sell-off, Chubb said. For the last year, corporations have been some of the bigger purchasers of stocks, buying back their own shares. But they are barred from doing that ahead of reporting their own earnings, which traditionally occurs in October. That doesn't help a slumping market, Chubb said.

By Friday, the interest rate and tariff fears seemed to abate. U.S. consumer prices in September came in lower than expected at 0.1 percent Thursday, suggesting that inflation isn’t ramping up. The Federal Reserve hikes rates to tamp down inflationary pressures.

On the trade front, tensions appeared to dissipate some after reports that President Donald Trump and Chinese leader Xi Jinping will meet at the G-20 summit in November. An import-export report from China also showed trade remained robust, even with the U.S.

The fundamentals of the economy also remain strong and should dissuade investors from bolting for the door, said Joe Wirbick, president of Sequinox, a financial planning firm in Lancaster, Pennsylvania. For instance, the unemployment rate is near a 50-year low, among other encouraging factors.

""Just because the market has been on the rise for such a long time doesn't mean the race is over,"" Wirbick said. ""Markets shift. That's just life.""

Read or Share this story: https://www.usatoday.com/story/money/markets/2018/10/12/stock-market-dow-jones-industrial-average-today/1612684002/"
The stock market’s nightmare may be far from over,"Everett Collection It’s a scary time for stock investors.

After a nail-biting week with the Dow Jones Industrial Average sinking nearly 1,400 points over two sessions, the jury is still out on whether the selloff signals a fundamental shift in the stock market or a brief episodic correction.

But one thing is certain: Investors should brace for more market drama in the coming days as corporate earnings, rising interest rates and economic data all converge to create an angst-ridden trading backdrop.

Stocks bounced back decisively on Friday with major indexes finishing in positive territory even though they were sharply lower for the week. The fact the market closed on a strong note heading into the weekend negates some of the “technical damage” wrought earlier, according to Jeffrey Saut, chief investment strategist at Raymond James.

But the mood on Wall Street was one of caution rather than euphoria.

Tony Dwyer, chief market strategist at Canaccord Genuity, believes the market may not have found its bottom yet.

“When you get this kind of correction in the broad equity market and surge in volatility, there is typically a bit more downside — either right away or on a retest,” he said in a Friday tweet.

It certainly has not been pretty. The S&P 500 SPX, +0.82% fell 5.1% in the first two weeks of October, its worst start to a fourth quarter since 2008. When the large-cap index drops 5% or more during the first 10 trading days of a quarter, it falls 79% of the time for an average quarterly decline of 11.3%, according to the Dow Jones Data Group.

Still, Dwyer told MarketWatch that he is not revising his upbeat outlook.

“Nope, haven’t changed it yet,” he said, sticking with his year-end target of 3,200 for the large cap index.

To be sure, investors may have been lulled into a false sense of complacency with the S&P 500 not having had a 1% move in 74 days until things went haywire on Wednesday. Yet, market observers were quick to point out that dramatic swings are a normal part of trading and investors should prepare for volatility to pick up going forward.

“We believe investors should expect a more normal amount of volatility from stocks versus what we experienced when interest rates were at their ultra-low levels, since higher yields on bonds and short-term cash now provide a better competitor to stocks,” said Bill Stone, co-chief investment officer at Avalon Advisors LLC, in a note to clients.

Since 1928, the S&P 500 has logged a 5% decline about every two months and a 10% drop every six months.

“On average the S&P 500 has experienced intrayear declines of almost 14% since 1980 despite going on to post annual gains in over 75% of those 38 years,” he said.

And higher volatility is not necessarily the bogeyman that it’s made out to be.

Jonathan Golub, chief U.S. equity strategist at Credit Suisse, reiterated his bullish call on stocks, pointing out that investing in times of volatility spikes pays off.

Credit Suisse

The Cboe Volatility index VIX, -3.83% also known as Wall Street’s fear index, soared to above 28 this week, a level it had not traded at since February.

Aside from earnings, a slew of economic data from retail sales to industrial production as well as FOMC minutes are likely to provide a more in-depth look into the state of the economy with the Federal Reserve widely expected to hike interest rates again by the end the year.

But in the wake of the market’s blood-letting, Matthew Luzzetti, senior economist at Deutsche Bank, suggested that the Fed could back off from its hawkish stance if stocks continue to swoon.

“All else equal, a further 10% decline in equities, which would amount to a roughly 15% decline from the recent peak, that would erase this year’s gains, would be needed to tighten financial conditions by enough to materially impact the Fed,” he said in a report.

When all is said and done, it’s worth noting that the historic crashes of 1929, 1987, and 2008 happened in October and things could get even more choppy this year due to a number of factors, according to Jeff Hirsch, editor of the Stock Trader’s Almanac.

Jeff Hirsch

“We may get some more downside this year than the average October, but with all the midterm machinations, Fed activity, frothy sentiment and rich valuations that is understandable,” he wrote in a recent blog post.

Providing critical information for the U.S. trading day. Subscribe to MarketWatch's free Need to Know newsletter. Sign up here."
Dow soars 287 points but still suffers worst week since March,"New York (CNN Business) The stock market is on the comeback trail.

After another wobbly session, the Dow soared 287 points, or 1.2%, on Friday. It was the index's best day since August.

The Dow had soared 400 points at the open before giving up most of those gains and then resuming its rally. The Dow lost 1,378 points over Wednesday and Thursday.

The broader S&P 500 jumped 1.4% on Friday. The Nasdaq, which has taken the brunt of the recent stock market turbulence, spiked 2.3%.

Despite Friday's rebound, all three major indexes suffered their worst weeks since March. And the S&P 500 is down three straight weeks. That hasn't happened since the Brexit referendum of June 2016.

Investing experts weren't exactly sure what turned stocks negative by midday. The driving forces behind this week's downturn -- trade war and interest rate fears -- were around before this week, and yet market volatility is spiking.

""The sellers have control right now,"" said Justin Walters, co-founder of Bespoke Investment Group. ""The scariest sell offs are the ones you can't tie to a specific reason.""

Stocks had turned sharply south over the past week because investors are concerned about rising interest rates. As the Federal Reserve raises rates to keep the economy from overheating, investors have been getting out of bonds, driving down their price and driving up their yields. Suddenly, the return on bonds has become competitive with some stocks — particularly risky tech stocks.

Rising interest rates also increase borrowing costs for households and businesses, eating into corporate profits.

""What we are seeing now is changing sands. The ground isn't stable and people are figuring out where to go next,"" said JJ Kinahan, chief market strategist with TD Ameritrade.

Tech stocks have come under fire because they are some of the riskiest and most expensive parts of the market. Investors fear that tech companies may not hold up well in a downturn, particularly as interest rates spike. A proxy for the tech sector had its sharpest plunge in seven years on Wednesday.

But Big Tech on Friday regained some of its losses. Facebook ( FB ), Apple ( AAPL ), Amazon ( AMZN ), Netflix ( NFLX ) and Google ( GOOGL ) were all up.

Asian and European markets also came back Friday . The Hang Seng soared 2.2%. Stocks in Shanghai rose 0.9% and the Nikkei rose 0.5%. Stocks in London, Germany and France all rose about a half percentage point.

Markets had bounced back Friday morning following news that President Donald Trump plans to meet next month with Chinese leader Xi Jinping at the G-20 summit. That eased some of investors' fears about another trade war escalation. China also reported reported its exports rose nearly 15% in September , stronger than expected. That suggests China is weathering the first waves of new tariffs that the Trump administration imposed on $50 billion of Chinese exports this summer.

But Kinahan is still worried about US-China trade talks. He thinks that a deal is key in order for the markets to get back on track, adding that a full-blown trade war could undo much of the positives from the Trump administration's pro-business policies.

""The concern is that if nobody blinks, it could negate all the tax cuts we had,"" he said.

Earnings season also kicked off Friday morning, with JPMorgan ( JPM ) and Citigroup ( C ) reporting their quarterly finances before the bell. Wall Street analysts expected the financial sector to post another incredibly profitable quarter — and JPMorgan managed to beat their already lofty expectations

In times of market turbulence, there's nothing like soaring profits to calm investors' nerves.

Rebounds after disastrous market selloffs are common. Investors who think the market may be oversold look to buy stocks they think are suddenly cheap.

But markets are fickle."
